query name,avg_round
get dateformatsymbols instance for default locale,0.0
support alpha in colormodel,0.0
write array of bytes to output stream,0.0
remove listener for attributechangenotifications,0.0
add server side request interceptor to list of server side request interceptors,0.0
give notification from document,0.0
return percentage format for default format locale,0.0
remove vetoablechangelistener from beancontextchild,0.0
get issueruniqueid value from certificate,0.0
initialize agreement with key,0.0
return number of entries in zip,0.0
visit value in annotation,1.0
read point value from input stream,0.0
remove menu items from menu,0.0
append text to end of the document,0.0
return path for passed,0.0
return enumeration value table for class jobstate,0.0
return copy of this localtime with number of nanoseconds,0.0
obtain instrument from patch,0.0
return level of the character at index,0.0
apply sslparameters to engine,0.0
return tab icon at index,0.0
return copy of this offsetdatetime with time,0.0
get location object with name,0.0
return border instance for text component,0.0
return name for dataflavor,0.0
grant permission with permission target name,0.0
extract reference to corba object,0.0
map resultset column label to resultset column index,0.0
set row in object,0.0
support cpu time measurement for thread,0.0
get subcodes for soapfault,0.0
decode ssl tls network data into subsequence of plaintext application data buffers,0.0
return number of columns in textfield,0.0
schedule task for delay execution,1.0
convert argument to long,1.0
associate value with key,1.833
retrieve attribute value from list of attribute values,0.0
add attribute value to list of attribute values,0.0
retrieve connection request controls in effect,0.0
return hash code for serialdatalink,0.0
obtain instance of monthday from text string,1.0
obtain date from era,1.0
set location of the end points to coordinates,0.0
return builder for longstream,0.0
write bits to stream,0.0
get location of this component in form of a point,0.0
register driver with drivermanager,0.0
get value of the named int field from field,0.0
return shaper for unicode,0.0
obtain instance of thaibuddhistera from int value,0.0
write idl value to output stream,1.0
add value to value of the field of the given object,0.0
fetch reader for parser,0.0
set line number for locator,0.0
write stream of uninterpreted bytes to sqloutputimpl,0.0
remove component from tooltip control,0.0
return object for charset,0.0
add child within beancontext,0.0
return rule for determining,0.0
enable escape processing for object,0.0
put text nodes in depth of the sub,0.0
set pattern to pattern,0.0
update column with ascii stream value,0.0
invoke containscustomcomponents method on ui,0.0
return encoder instance without adding,0.0
remove attribute from list,0.0
provide settings for object,0.0
write string to file,1.0
return value for crl entry,0.0
pass string into client property,0.0
return path in selection,0.0
create soapbodyelement object with qname,0.0
convert duration to length,0.0
return amount of space between text,0.0
create dispatch instance for use,0.0
remove propertychangelistener from beancontextchild,0.0
determine span along axis,0.0
extract char value from dynany,0.0
create transition instance for year,0.0
return longstream with array,0.0
get collection of alternative issuer names from issueraltname extension,0.0
obtain date from era,1.0
return path to child of parent,0.0
get time in seconds,0.0
calculate size dimensions for container,0.0
close channels in group,0.0
set attribute in list,0.0
append menu item to end of this menu,1.0
return value given array of unnormalized color alpha components,0.0
set sequencer position in midi ticks,0.0
compare group identifiers for content equality,0.0
set value for cell,1.0
remove changelistener from progress bar,0.0
get notification types for filter,0.0
register object with watch service,0.0
process events on choice,0.0
generate hash code for sequence of input values,0.0
return arguments for method,0.0
convert bigdecimal to double,0.0
get keystore entry for alias,0.0
obtain minguodate from system clock,1.0
return intstream from startinclusive,0.0
return string including indications of run state,0.0
set data model for menu button,0.0
set default value of the usecaches field to value,0.0
remove binding for key,0.0
construct path between path,0.0
set base name for locating,0.0
retrieve description of the foreign key columns in table,0.0
remove permission from acl entry,0.0
remove service provider object from category,0.0
start element of legs between nodes,1.0
create updater for objects,0.0
enable output for class loading system,0.0
set insets for view,0.0
specify handling of multiple copies for jobs,0.0
get collation element in string,1.0
get property with key,0.0
return key in map,1.0
set color of the color chooser to rgb color,0.0
disable input method support for text,0.0
get port number for connection,0.0
assign char value to element of the specified array of chars,0.0
move component to position,1.0
replace occurrences of specified value in list,0.0
update synthstyles from synthstylefactory,0.0
present parameter types as list,0.0
convert nm string to entity type,0.0
assign value to element of the specified array of longs,0.0
return gap between components,1.0
return name in style of this timezone,0.0
set location of the end points of this curve to same,0.0
return invocation handler for proxy instance,0.0
return dimension from defaults,0.0
propagate event from beancontext,0.0
allow removal of event listeners from event target,0.0
read lines from file,1.0
populate inputmap with bindings,0.0
return pseudorandom float value between zero,0.0
read bit from stream,0.0
scroll axis along axis,0.0
return reference to policy object,0.0
get cookies from cookie cache,0.0
add components of a composite name to end of this composite name,0.0
return name for data format,0.0
put value of the named long field into field,0.0
return collationelementiterator for characteriterator,0.0
write set of attributes to object stream,0.0
return component in range,1.0
remove set of attributes for element,0.0
convert date time to offsetdatetime,0.0
return breakiterator instance for sentence breaks,0.0
generate html output from styleddocument,0.0
override method as member of a given type,0.0
return index within string of the first occurrence of the specified character,1.0
insert string at bit unit,0.0
activate input method for input processing,0.0
invoke getminimumdividerlocation method on ui,0.0
return optionallong with value,0.0
set focus traversal policy for container,0.0
return copy of this localdate with number of years,0.0
return component in path,0.0
return copy of this localdatetime with number of minutes,0.0
intersect clip with rectangle,0.0
return transparency mode for color,0.0
produce method handle for constructor,0.0
obtain timing resolution for sequence,0.0
return default port for url,0.0
concatenate affinetransform to affinetransform,1.0
create retrievalmethod from parameters,0.0
compare attribute object with attribute object,0.0
return child in child array,0.0
return soapfault object in soapbody object,0.0
return default affinetransform for graphicsconfiguration,0.0
apply attributes to paragraphs,0.0
create detailentry object with name,0.0
return copy of this localdatetime with number of years,0.0
split input sequence around matches of this pattern,0.0
set value pair in state of the scriptengine,0.0
return hash code value for openmbeanoperationinfo instance,0.0
return position for cursor,0.0
render range in model,0.0
return value as double,1.0
begin insertion of a new image with pixel values,0.0
set bit at index,0.0
add component to container,1.6
return string table for class finishings,0.0
create pixelinterleavedsamplemodel with width,0.0
receive focus events from component,0.0
return number of banks in databuffer,0.0
write attribute to stream,1.0
compare obj with openmbeanattributeinfosupport instance,0.0
install listeners into viewport,0.0
set command name for action event,0.0
return layeredpane object for dialog,0.0
return iterator over elements,1.0
return graphics2d object for rendering,0.0
insert component into menu,0.0
get host name for ip address,0.0
treat ends of line as tokens,0.0
return bindings with scope value,0.0
set age of the cookie in seconds,0.0
set parameters with setparameter,0.0
determine character representation for digit,0.0
remove attribute with name,0.0
move iterator to occurrence of the tag,0.0
parse xml document from system identifier,0.0
return hash code value for simpledateformat object,0.0
return copy of this localdatetime with number of days,0.0
set extension for key,0.0
return contentpane object for dialog,0.0
set name field of this result to name,0.0
convert location in model,0.0
process input method events as such,0.0
return number of bits for band,0.0
return index of node in receivers,0.0
return square of the distance from point2d,0.0
remove elements from queue,0.0
select text in text component,0.0
return icon for input method,0.0
retrieve attribute in sqlinputimpl object,1.636
invoke installui method on ui,0.0
return copy of this offsettime with nano,0.0
convert xmlgregoriancalendar to gregoriancalendar,0.0
compute parameters for blit,0.0
create line border withe color,0.0
return array of all tagged components with given,0.0
set background color at index,0.0
hold pixels for image,0.0
decode string into short,0.0
write int to sqloutputimpl,0.0
return copy of this duration with duration,0.0
remove dragsourcelistener from dragsource,0.0
append element to end of this list,0.0
return copy of the specified temporal object with period,0.0
load keymap with bunch of bindings,0.0
obtain date in buddhist calendar system,0.0
set default assertion status for class loader,0.0
obtain timing division type for sequence,0.0
register channel with selector,1.0
compare obj for equality,0.0
set features properties on implementation,0.0
write byte to output stream,2.0
convert color string as such,0.0
fetch stylesheet with display rules,0.0
define columns in database,0.0
initialize command with verb,0.0
set default locale for category,0.0
add imageconsumer to list of interested consumers,1.0
compare method against object,0.0
return spliterator over elements,0.0
return sslparameters in effect,0.0
add attribute to string,0.0
reset ui property with value,0.0
return dimensions for layout,1.0
compare propertydescriptor against object,0.0
set icon for button,1.0
retrieve number of addresses in reference,0.0
parse string argument as decimal byte,0.0
return code for event,1.0
return stub for rmiserver object,0.0
return icon for button,1.0
return data arrays for banks,0.0
provide access to stack trace information,0.0
compare command environments for content equality,0.0
break node into nodes,0.0
set parameter to java,1.0
obtain instance of chronozoneddatetime from object,0.0
return checksum for input stream,0.0
fetch context for managing,0.0
dir root of a tree in file system,0.0
read number of bytes from input stream,0.0
set input data for compression,0.0
compare chronology to chronology,0.0
return screen resolution in dots,0.0
return samples for rectangle of pixels,0.0
write value to stream,1.0
set parameter to value,1.0
scroll view to reference location,0.0
return handler for socket creation failure,0.0
compare object with kerberosticket,0.0
bring dialog with options,0.0
return number of bits for bands,0.0
update column with int value,0.0
create savepoint with name,0.0
add object to joinrowset object,0.0
initialize mac object with key,0.0
return width of the display in pixels,0.0
provide mapping from document model,0.0
get end entity certificate from certificate chain,0.0
compare buffer to another,0.0
impose pages upon sides of the print medium,0.0
set data for midi message,0.0
add itemlistener to checkbox,0.0
return component for tabbedpane,0.0
report change to character action,0.0
create view from element,0.0
obtain soundbank object from file,0.0
return size in pixels,0.0
run tool with channels,0.0
get string for key,0.0
encode string into bytes,0.0
return code for awtkeystroke,0.0
return value of this byte as int,0.0
return inputstream for dataflavor,0.0
write changes in rowset,0.0
create area object as area,0.0
invoke method on ui,1.0
set state of this check box to state,0.0
initialize parameter generator for size,0.0
wrap array into buffer,1.0
start drag given cursor,0.0
receive object for locating,0.0
write fields to stream,0.0
set layout of this component by default,0.0
return reflection delay time in microseconds,0.0
parse string argument as integer,1.0
return number of buttons in group,0.0
return float value given value of the control point,0.0
return hashcode for roundrectangle2d,0.0
update uis for labels,0.0
fetch tabexpander to use,0.0
replace value with value,0.0
return unicodeblock with name,0.0
return samples in band,0.0
obtain state for track,0.0
write float to sqloutputimpl,0.0
set input value in option pane,0.0
return samples for pixel,1.0
perform layout on box,0.0
view bean as target type,0.0
return intstream from startinclusive,0.0
return value for object reference,1.0
return copy of this zoneddatetime with number of weeks,0.0
set editor in tablecolumn,0.0
compare calendar to object,0.0
get items on list,1.0
return parameter object for algorithm,0.0
get writer for file object,0.0
write attribute to stream,1.0
allow dispatch of events into implementations event model,0.0
set position of the caret from coordinates of a mouse event,0.0
add components of a name to end of this name,0.0
return codebase for object reference,0.0
get dimensions for text field,0.0
return iterator over elements,1.0
set policy on removed,0.0
obtain instance of offsetdatetime from text string,0.0
compare certificate for equality,0.0
determine integer in set attribute,0.0
create reference with parameters,0.0
provide hint about access level of the class,0.0
break view on axis,1.0
return advance width for showing,0.0
get string array for key,0.0
get value of the named char field from field,0.0
remove item at index,0.0
set parameter to short,0.0
return printable for use,0.0
show window depending on value of parameter,0.0
return value of the system property with name,0.0
return number of zero bits following bit,0.0
return number of string objects in contextlist object,0.0
update memory image by sending,0.0
alter table with add,0.0
parse string argument as short,0.0
compare offsettime to time,0.0
return delay in milliseconds,1.0
find descriptor for class,0.0
support conversion from source format,0.0
get class object for target interface,0.0
insert typecode object into dynany,0.0
obtain size in bytes of the entire audio,0.0
obtain date in buddhist calendar system,0.0
remove items from choice menu,0.0
replace entry in list of source,0.0
return executor for endpointinstance,0.0
return copy of this localdatetime with year,0.0
process events on text component,0.0
give hint as to number of rows,0.0
add css attribute to set,0.0
insert string object into value field,0.0
get content of this attachmentpart object as byte array,0.0
return tab stop position given reference position,0.0
return lifetime in seconds,0.0
apply sslparameters to socket,0.0
remove changelistener from model,0.0
get font from system properties,0.0
return element in set,1.0
cast object of a remote interface type to type,0.0
get error event handler in effect,0.0
wrap char array into buffer,0.0
set soapmessage in message context,0.0
create xmlgregoriancalendar from gregoriancalendar,0.0
return hash code value for collection,0.0
set alignment for label,0.0
retrieve attribute with feature,0.0
put value association into preference node,0.0
create parallelgroup with alignment,0.0
set event allocator for events,0.0
create timer notification with type,0.0
read bytes of data from stream,0.0
return path to menu item,0.0
initialize members from sequence of namevaluepairs,0.0
compare mbeannotificationinfo to another,0.0
return copy of this duration with duration,0.0
update column with value,0.0
return serialblob object as input stream,0.0
return copy of this period with years,0.0
obtain instance of zoneoffset from object,0.0
set treecellrenderer to tcr,0.0
treat case as insensitive,0.0
push output to target handler,0.0
get formatting pattern for date,0.0
return certificate objects for entry,0.0
set location of this point2d to float,0.0
read attribute in stream,0.0
add member to group,0.0
return hash code value for stack trace element,0.0
write attribute to stream,1.0
set number of minutes in timezone,0.0
remove driver from list of registered drivers,0.0
set gap between components,1.0
assign byte value to element of the specified range of the specified array of bytes,0.0
set parameter to byte,0.0
remove element from list,1.0
return copy of this duration with duration,0.0
set default classloader for connector server,0.0
return hashcode for rectangle2d,0.0
register parameter in position parameterindex,1.0
visit char value in annotation,0.0
obtain date in chronology,1.0
convert bigdecimal to short,0.0
remove value for class,0.0
compare object to object,1.75
retrieve number of typecode objects in object,0.0
provide hint as to get,0.0
return type for cursor,0.0
get amount of empty space in pixels,0.0
read bit integer from file,0.0
retrieve value of the designated column in row of this resultset object,1.474
obtain information about device,0.0
return object in interface repository,0.0
compare obj with instance,0.0
end string with suffix,0.0
return copy of this localdate with number of days,0.0
paint tabs in tab area,0.0
return value for parameter,2.0
set content of the soapenvelope object with data,0.0
return string table for class jobstate,0.0
create border with edge,1.0
return string table for class,0.0
create spliterator over elements,1.0
return default starting directory,0.0
connect output stream to receiver,0.0
return set for traversal operation,0.0
set namespace context for prefix,0.0
return zipentry for entry name,0.0
change selection in menu hierarchy,0.0
return child of parent at index index,0.0
return name of the encoding format for key,0.0
compare finite field for equality,0.0
return number of pages in set,0.0
fetch graphics for rendering,0.0
return background color for cells,0.0
set object value for cell,0.0
return value for nth header field,0.0
read attribute in stream,0.0
set keyboard mnemonic on model,0.0
set echo character for jpasswordfield,0.0
return tab index with title,0.0
return value of this short as double,0.0
set diagonal of the framing rectangle of this shape based on coordinates,0.0
return child at index,0.0
add service contexts to request,0.0
get multiplier for use,0.0
return iterator over name elements of this path,0.0
set feature for transformerfactory,0.0
set vector of sources to vector,0.0
install abstractformatter onto jformattedtextfield,0.0
write object to sql data stream,0.0
return length for transformation,0.0
return glass pane for jrootpane,0.0
return glasspane object for applet,0.0
remove values in state hashtables,0.0
import parameters from params,0.0
remove number of available elements from queue,0.0
open connection to url,0.0
set samples for rectangle of pixels,0.0
convert string in jdbc date escape format,0.0
read len floats from stream,0.0
write attribute to stream,1.0
set bits from fromindex,0.0
compare attribute name to another,0.0
set time with date,0.0
obtain hijrahdate of the umm al qura calendar from proleptic year month day fields,0.0
play clip given url,0.0
remove menu component from menu bar,0.0
enable credential delegation on context,0.0
return bounds of the specified tab in space of the jtabbedpane component,0.0
obtain instance of yearmonth from year,0.0
fetch index within element,0.0
return enumeration value table for enumeration class,0.0
return array type with component type,0.0
publish changes in preferences,0.0
fetch default value for attribute,0.0
read value from input stream,1.0
receive mouse events from trayicon,0.0
write idl value to output stream,1.0
return size for separator,1.0
return map of the specified dataflavors to string,0.0
get fault code for soapfault object,1.0
return delay in time unit,0.0
get reader for text flavor,0.0
assign int value to element of the specified range of the specified array of ints,0.0
fetch offset from beginning of the document,0.0
return number of value mappings in map,0.0
place input stream for socket,0.0
return hash code value for redirect,0.0
perform reduction on elements of this stream,1.0
set rowmargin to intercellspacing,0.0
retain elements in collection,0.0
convert date to epoch day,0.0
return name in style of this timezone,0.0
retrieve value of the designated column in row of this resultset object,1.474
remove menukeylistener from popup menu,0.0
wrap array into buffer,1.0
read class descriptor from serialization stream,0.0
apply operator to operands,0.0
associate message digest with stream,0.0
return representation of the specified point value according to ieee point format layout,1.0
remove range of bit units from node,0.0
output value in byteholder,0.0
add dragsourcemotionlistener to dragsource,0.0
abort read via abort method,0.0
retrieve attribute in sqlinputimpl object,1.636
retrieve role info for role of a relation type,0.0
set parameter in command,0.0
obtain instance of dayofweek from object,0.0
return name for currency,0.0
create xmleventreader from java,0.0
add iioreadprogresslistener to list of registered progress listeners,0.0
read end tag for custom valuetype,0.0
return code for event,1.0
return int to argument,0.0
return country region code for locale,0.0
set locale of this imagewriter to value,0.0
convert sql statement into sql grammar,0.0
return item in map,0.0
clear parameters set for command,0.0
return offsets array for baselines,0.0
set number of columns in model,0.0
return copy of this duration with duration,0.0
add mimeheader object with name,0.0
return default icon for laf,0.0
add component to end of this compound name,0.0
reset polygon object to polygon,0.0
set time zone for calendar of this dateformat object,0.0
return copy of this duration with amount of seconds,0.0
return string table for class jobsheets,0.0
add mapping from string,0.0
abort write to iiowriteprogresslisteners,0.0
create mouse listener for jtable,0.0
set size of this rectangle to width,0.0
convert string argument into qname value,0.0
remove imageconsumer from list of interested consumers,0.0
connect socket to socket address,0.0
invoke tabforcoordinate method on ui,0.0
return zip for name,0.0
ostream value in value field of the holder,0.0
return value for class,0.0
convert object to zoneid,0.0
report property update to listeners,1.917
remove listener from print job,0.0
add referenceparameter to w3cendpointreference instance,0.0
call method on script object,0.0
return purpose number format for default format locale,0.0
add byte to list of parameters,0.0
return thread info for thread,1.0
add trayicon to systemtray,0.0
compare principal to object,0.0
perform reduction on elements of this stream,1.0
return hash code for float object,0.0
obtain file type as such,0.0
get xinclude processing mode for parser,0.0
get package for class,0.0
return attributes for jar,0.0
add iiowritewarninglistener to list of registered warning listeners,0.0
support data flavor for object,0.0
return border instance for jsplitpane divider,0.0
return activation system for vm,0.0
add input output argument to request object,0.0
read line of text from input stream,0.0
return number of bits in representation of the specified int value,0.0
return token from string tokenizer,0.0
write len bytes from byte array,0.0
propagate invalidate up tree,0.0
return renderer for cell,0.0
set rectangle of this rectangle to width,0.0
focus component before focus owner,0.0
remove iioreadupdatelistener from list of registered update listeners,0.0
get accessiblecontext for progressmonitor,0.0
start drag given cursor,0.0
obtain number of midi available connections for transmitting,0.0
create request instance for use,0.0
reset xpath to configuration,0.0
remove acolumn from array of columns,0.0
insert string representation of the object argument into character sequence,0.0
reset checksum to value,0.0
convert string argument into array of bytes,0.0
determine limits on size of the message,0.0
return rootpane object for frame,0.0
obtain instance of zoneddatetime from date,0.0
return copy of this offsetdatetime with number of months,0.0
combine date with time of midnight,0.0
write attribute to output stream,1.0
create typecode object for idl type,0.0
create multipixelpackedsamplemodel with subset of the bands of this multipixelpackedsamplemodel,0.0
insert string representation of the char array argument into sequence,0.0
set slot in portableinterceptor,0.0
add region to region list,0.0
add component in list of components,0.0
receive window events from window,0.0
return position in serialclob object,0.0
test leafness by asking,0.0
convert point to screen coordinates,0.0
return element in iteration,0.0
set image for trayicon,0.0
set base for templates object,0.0
return tail string for set of xml,0.0
set size of this window to value,0.0
return copy of this zoneddatetime with number of months,0.0
add listener to list,0.0
return text string between indices,0.0
return hash code for sortkey,0.0
visit enum value in annotation,0.0
combine components for int pixels,0.0
return string before index,0.0
write idl string value to output stream,1.0
obtain chronoperiod between dates,0.0
return keys for kerberos,0.0
get matching aliases for authenticating,0.0
return hashcode for composite,0.0
write byte to array output stream,0.0
add attribute to attribute,1.0
add attribute to element,0.0
read sql value from stream,0.0
add object to joinrowset object,0.0
obtain date from era,1.0
add title to border,1.0
return hash code for shaper,0.0
set handler for tasks,0.0
end path with path,0.0
