query name,avg_round
represent time after time,0.0
return flatness of curve,0.0
return iterator over namespace prefix strings,0.0
return copy of this period with amounts of each unit,0.0
create listeners for combo box,0.0
set paper size for pages,0.0
set attributes for text,0.0
create statement object for sending,0.0
return point size given size index,0.0
return value for certificate,1.0
create border with edge,1.0
set beancontext for beancontextchildsupport,0.0
indicate location within coordinates,0.0
set value of the dynenum as value,0.0
return default icon for laf,0.0
get layer property for jcomponent,0.0
add filter to list of user choosable,0.0
receive action events from text field,0.0
subtract shape of the specified area from shape of this area,0.0
activate iiometadatacontroller for object,0.0
read bytes of data from input stream,1.0
return index argument from call,1.0
return size of the table for tag,0.0
add color chooser panel to color chooser,0.0
obtain instance of time from localtime object,0.0
retrieve syncprovider implementation for object,0.0
return size for thumb,1.0
read data from input stream,0.0
support subqueries in comparison expressions,0.0
return hash code value for code signer,0.0
remove newchild from parent,0.0
return tile height in pixels,0.0
insert element into list,0.0
combine date time with time zone,1.0
associate object references with object identifiers,0.0
return constraints on target certificate,0.0
fetch offset within document,0.0
create channel group with thread pool,1.0
encode string into sequence of bytes,1.0
write long to file,0.0
break view on axis,1.0
translate coordinates to position,0.0
remove provider with name,0.0
return name of the member at position,0.0
get object for key,0.0
return identifier for object adapter,0.0
set position to getbeginindex,0.0
read bytes from stream,1.778
return breakiterator instance for line breaks,0.0
determine alignment for view,0.0
convert duration to length,0.0
move component to position,1.0
extract value from dynany,1.0
restore drawing buffer from state,0.0
invoke getdividerlocation method on ui,0.0
receive focus events from component,0.0
compare values for equality,0.0
return string including type,0.0
set time zone with time zone value,0.0
set type for object,1.0
get size for editor component,1.0
set angle of this arc to value,0.0
return hash code value for instance,0.0
insert element at front of this deque,1.333
set component at index,0.0
retrieve value of the designated column in row of this resultset object,1.474
add binding for key,0.0
return qname for attribute,0.0
insert element at tail of this queue,1.429
write byte to file,0.0
write sql datalink value to stream,0.0
obtain date from era,1.0
set error event listener for transformerfactory,0.0
initialize pair generator for keysize,1.0
set constraints for component,0.0
remove bindings from keymap,0.0
return component at top of the hierarchy,0.0
create context for compositing operation,0.0
obtain input stream from file,1.0
retreive value from defaults table,0.0
return index within bank,0.0
add column to model,0.0
convert enumeration instance to enumeration value,0.0
add component to container,1.6
read bytes from stream,1.778
obtain instance of month from object,0.0
set role in relation,0.0
write value to output stream,1.0
obtain date from epoch day,1.0
set attributes for paragraph,0.0
extract range of data from node,0.0
convert string object in jdbc,0.0
create ui for jformattedtextfield,0.0
schedule task for execution,1.0
return purpose numberformat instance for locale,0.0
compare object with rdn,0.0
set timeout value in milliseconds,0.0
return number of views in view,0.0
get value of the specified field from offset,0.0
create ui object for component,0.0
end path with path,0.0
convert biginteger to short,0.0
return specifier for image format,0.0
set obj as value,0.0
set tempo in microseconds,0.0
return copy of this duration with duration,0.0
set limit for number of bytes,0.0
retain elements in set,0.0
set target object for relation,0.0
calculate amount of time between objects,0.0
obtain data byte in message,1.0
insert item into item list,0.0
get encoding name from name,0.0
start work on behalf of a transaction branch,0.0
process source into transformer object,0.0
set flag for object,0.0
return doubleconsumer after the,0.0
notify listeners for notification,0.0
set output destination to file,0.0
read idl corba::object from input stream,0.0
return roles in relation,0.0
truncate file to size,0.0
read len bytes from file,0.0
get size for editor component,1.0
get attribute names for filter,0.0
enable traversal keys for component,0.0
retrieve value of the designated column in row of this resultset object,1.474
return keytab instance from file object,0.0
compare object with map,1.0
read attribute in stream,0.0
get value of the named byte field from field,0.0
create object for calling,0.0
get value of the named long field from field,0.0
convert jlist coordinate to row,0.0
invoke operation occording to contents of the request message,0.0
add iioreadupdatelistener to list of registered update listeners,0.0
parse token from input stream of this tokenizer,0.0
return copy of the service context with given,0.0
return sslparameters in effect,0.0
return value for attribute,1.0
return copy of this period with amount of days,0.0
return index into list of elements,0.0
add object in set of observed mbeans,1.0
replace object in list of parameters,0.0
return stream pointer to position,0.0
insert elements in bulk,0.0
insert string representation of the char argument into sequence,0.0
return offset into document,0.0
set pixel to rgb value,0.0
write property list in properties table,1.0
fetch reference to text,0.0
change state of the poa manager to holding,0.0
return copy of this offsettime with number of seconds,0.0
return field names in descriptor,0.0
extract value from dynany,1.0
return set for traversal operation,0.0
add component to container,1.6
convert interface address to string,0.0
get index with hypertext document,0.0
return iterator for elements of this stream,0.0
return copy of this duration with duration,0.0
return default value for parameter,1.0
insert element at front of this deque,1.333
convert value into string,1.0
remove changelistener from listener list,0.0
read attribute in stream,0.0
return text of text nodes to node,0.0
remove field from descriptor,0.0
reset count field of this byte array output stream to zero,0.0
obtain midi sequence from url,0.0
return type for values of the attribute,0.0
append geometry of the specified shape object to path,0.0
add set of attributes to list,0.0
return renderedimage instance of this image with default width,0.0
allow access request based on accesscontrolcontext policy,0.0
obtain type information from servant,0.0
return inetaddress object given ip address,0.0
determine position in model,0.0
remove paths from selection,0.0
set logger to level,0.0
remove key from map,0.0
return default channel provider for invocation of the java virtual machine,0.0
apply function to argument,0.0
return number of color components in colormodel,0.0
return samples for pixel,1.0
obtain date from era,1.0
add mappings in map,0.0
calculate amount of time until year month,0.0
convert string argument into value,0.0
write array of bytes to blob value,0.0
write block of compressed data to output stream,0.0
create object for string protocol,1.0
allow values in parameter,0.0
return value for oldinstance,0.0
return tile index in direction,0.0
write string value to stream,1.0
set transform to inverse of itself,0.0
add element type to metadata document format,1.0
authenticate mbeanserverconnection client with client credentials,0.0
set parameter to object,0.0
return editorkit class name for type type,0.0
remove value for variable,0.0
write image in mode,0.0
expand node in row,0.0
create reference with uri,0.0
convert string argument into value,0.0
return parameters for mask generation function,0.0
specify print quality for pages,0.0
create pathiterator for outline of area object,0.0
obtain decimalstyle for locale,0.0
retrieve array of controls from object,0.0
set subtype for object,0.0
receive mouse events from component,0.0
retrieve value of the designated column in row of this resultset object,1.474
fetch tag constant for tag name,0.0
disconnect editor from jspinner,0.0
return number of parameter types in method type,0.0
obtain date in chronology,1.0
return copy of this duration with length,0.0
return string table for class,0.0
obtain sax inputsource object from source object,0.0
initialize cipher with key,0.0
set location of this point2d to coordinates,0.0
return stub for object,0.0
remove mappings from map,0.0
return value of the specified number as short,0.0
retrieve exception code for sqlexception object,0.0
set location to float values,0.0
rotate elements in list,0.0
obtain date in chronology,1.0
convert docflavor to string,0.0
set location of this rectangle2d to values,0.0
return information about applet,0.0
add style into style hierarchy,0.0
return class loader for tools,0.0
return stream of pseudorandom int values from generator,0.0
send output to parent,0.0
set input selection values for pane,0.0
create link to target,0.0
return thread info for threads,0.0
return height of the page in 1/72nds of an inch,0.0
append character sequence to buffer,0.0
write byte to sqloutputimpl,0.0
get printable area as array of values,0.0
add title to border,1.0
create view for element,0.0
return hashcode for set of tabstops,0.0
process source into templates object,0.0
obtain position in sequence,0.0
prepare image for rendering,0.0
set kit for handling,0.0
return copy of this duration with nano,0.0
create xmleventreader from jaxp source,0.0
set location of the end points to point2d,0.0
return copy of this offsettime with number of nanoseconds,0.0
load keystore from input stream,0.0
process events on check box menu item,0.0
output value in holder,0.0
convert string argument into value,0.0
write data to outputstream,0.0
append character sequence to appendable,0.0
add components of a compound name to end of this compound name,0.0
create dispatch instance for use,0.0
return square of the distance from point2d,0.0
return enumeration over names of the attributes,0.0
return list of the platform mxbean proxies for forwarding,0.0
add reference object to queue,0.0
return baseline for tab,0.0
return hash code value for resolution,0.0
get source as reference of type beancontextservices,0.0
return string at index,0.0
remove image from stream,0.0
construct builder with components of an existing acl entry,0.0
initialize properties as such,0.0
convert value to string,1.0
acquire lock on file,0.0
return index of the first column in table,0.0
get version value from certificate,0.0
return dateformatsymbols instance for locale,0.0
create role element value for soapfault,0.0
set number of decimal digits in value,0.0
return repository for interface of the servant,0.0
add state to state,0.0
bring dialog panel with options,0.0
call drop on droptargetlistener,0.0
get date from crl,0.0
install mouse handlers on newpane,0.0
change requests for shape,0.0
change action for input errors,0.0
retrieve name of the class in java programming language,0.0
return copy of this localdatetime with altered,0.0
receive actionevents from trayicon,0.0
obtain duration from text string,0.0
return color component value for component,1.0
set location of the end points of this line2d to same,0.0
compare server name to object,0.0
return iteration of the encodings with default encoding,0.0
set values for calendar fields,0.0
fetch span along axis,0.0
write endpointreference to infoset format,0.0
set location of the outer bounds of this rectangle2d to values,0.0
decode bytes from input byte array,1.0
select item at index,0.0
obtain instance of offsetdatetime from date time,0.0
alter table with drop column,0.0
set cursor image to cursor,0.0
compute value for variable,0.0
set data for pixel,0.0
return algorithm name for key,0.0
get calendar with time zone,0.0
set queue length for connection indications,0.0
replace value with result of invoking,0.0
get context for window,0.0
return hashcode for text attribute,0.0
retrieve severity code for warning error,0.0
associate object to key,0.0
remove propertychangelistener from listener list,0.0
set field on event locator,0.0
determine change in data,0.0
return value for calendar field of this gregoriancalendar instance,1.0
write bits to stream,0.0
set position to values,0.0
return hash code value for instance,0.0
get number of columns in layout,0.0
get threshold value for mbean,0.0
insert text at position,0.0
return enumeration value table for class printerstatereason,0.0
return copy of this localtime with number of seconds,0.0
set parameter to array of bytes,0.0
return size for separator,1.0
scan token of the input as float,0.0
restore frame to size,0.0
get collator for default locale,0.0
convert socket to string,0.0
insert element into queue,1.0
create componentsamplemodel with width,0.0
obtain input stream of the specified encoding from input stream,0.0
support data definition within transaction,0.0
remove frame from parent,1.0
set transform to rotation transformation,0.0
set column title for use,0.0
return hash code for instant,0.0
return copy of this offsetdatetime with number of nanoseconds,0.0
set default assertion status for class loader,0.0
compute hash value for attribute name,0.0
add itemlistener to model,0.0
convert wrapper types to types,0.0
return class with name,0.0
uninstall event listeners for ui,0.0
apply pattern to format object,0.0
set icon for button,1.0
compare instant to instant,0.0
return object in sequence,0.0
scan token of the input into value,0.0
write access mode for role,0.0
compare color model with another,0.0
return character encoding for handler,0.0
add path to selection,1.0
get reference to schema,0.0
retrieve attribute in sqlinputimpl object,1.636
write len bytes from byte array,0.0
return position in stream,0.0
read value from input stream,1.0
get command list from mime type,0.0
read idl string from input stream,1.0
return doublestream with range of the specified array,0.0
reset barrier to state,0.0
set log writer for datasource object,0.0
apply visitor to value,0.0
add rules from stylesheet ss,0.0
indicate commitment towards triggering,0.0
add input output argument with name,0.0
place namespace declaration attributes into nsdecl namespace,0.0
fold value into result container,0.0
write attribute to stream,1.0
get traffic class for packets,0.0
mark place in sequence of character content,0.0
send notification for role update,0.0
determine offset into text,0.0
set caret movement policy on document,0.0
insert element at tail of this queue,1.429
return path element at index,0.0
return remainder from dividing,0.0
convert qname instance into string,0.0
compare biginteger with object,0.0
return copy of this localtime with number of hours,0.0
return commands for type of data,1.0
return method object for element,0.0
return permissioncollection object for storing,1.0
return samples for rectangle of pixels,0.0
retrieve values in transformation matrix,0.0
convert object to localdatetime,0.0
read data from input,0.0
append page to end of this book,0.0
return element at position,0.0
convert protectiondomain to string,0.0
identify menu item as armed,0.0
set filename filter for file dialog window,0.0
get date formatter with style,0.0
get decimalformatsymbols instance for locale,0.0
return name for language,0.0
process events on text field,0.0
write attribute to stream,1.0
move component to location,0.0
construct aclentry from components of this builder,0.0
retrieve value of the designated column in row of this resultset object,1.474
replace object in list of parameters,0.0
return iterator over elements,1.0
force changes in contents of this preference node,0.0
return hash code for serialstruct,0.0
produce numbers for activationgroupdescs,0.0
set calendar field to value,0.0
append character to writer,0.0
create border with edge,1.0
create listener reponsible for getting,0.0
convert character to utf-16 representation,0.0
remove component from layout,0.0
return reader for parser,0.0
create texthitinfo on side of the insertion point,0.0
obtain instance of localdate from text string,1.0
return hash code value for attribute,0.0
create jbutton for actions,0.0
acquire lock on file,0.0
return string table for class printerisacceptingjobs,0.0
get gap between components,1.0
append menu to end of the menu bar,0.0
set text for scanning,0.0
set clip to rectangle,0.0
return reference for object,1.75
append subsequence of the specified charsequence to sequence,0.0
return char value in sequence,0.0
compute hashcode for iterator,0.0
get base from resolved,0.0
read string value from input stream,1.0
make proxy for mxbean,1.0
return hash code for value,0.0
create soapelement object with name,0.0
remove propertychangelistener from listener list,0.0
initialize object for signing,0.0
remove component from layout,0.0
write sequence of bits to stream,0.0
add root node of the dom document to soapbody object,0.0
read byte from stream,1.0
return hash code for calendar,0.0
return icon for button,1.0
return iterator over elements,1.0
associate attribute with feature,0.0
convert contents into string,0.0
return copy of this offsetdatetime with number of years,0.0
invoke method on ui,1.0
set bit at index,0.0
return information about parameters,0.0
create writableraster with width,0.0
read char value from input stream,1.0
set layout manager for container,0.0
get mime type for file name,0.0
create parallelgroup with alignment of alignment,0.0
specify detail information about event,0.0
append time zone name as such,0.0
add component with tab title,0.0
return reference to object registry,1.0
return control object from input method,0.0
get representation as such,0.0
return certificate object for connection,0.0
remove element from set,0.0
align components along baseline,0.0
set state for track,1.0
get value from certificate,0.0
add response header with name,0.0
return value of this short as short,0.0
return hash code for parseposition,0.0
retrieve term for procedure,0.0
set identifier for source,1.0
write bits to stream,0.0
set number of columns in rowset object,0.0
bind name to object,1.667
modify we to listeners,0.0
convert string name to gssname object,0.0
create writableraster with location,1.0
return amount given unit,0.0
remove occurrence of item from choice menu,0.0
return hash code value for object,0.0
return string table for class mediatray,0.0
specify modal exclusion type for window,0.0
insert typecode object into value field,0.0
associate value with key,1.833
return cpu time for thread,1.0
initialize parameter generator for size,0.0
insert element into queue,1.0
set values for calendar fields,0.0
specify destination printer for jobs,0.0
move component to position,1.0
create hit on edge of the character,0.0
return list of available compression types as array,0.0
aid convenience method in implementation of the case mousewheellistener,0.0
make item at index,0.0
return commands for type of data,1.0
remove listeners from combo box model,0.0
return enumeration value table for class mediasizename,0.0
convert string to integer,0.0
return textlayout on character range,0.0
return value between zero,1.0
remove attribute from set,0.0
compare obj with openmbeanconstructorinfosupport instance,0.0
obtain input stream from input stream,0.0
return code for character,0.0
return serialversionuid for class,0.0
compare object name with object name,0.0
write value of any object to output stream,0.0
insert image into image stream,0.0
retrieve attributes on implementation,0.0
set type for object,1.0
return offset of this time zone from utc,0.0
write icc_profile to file,0.0
insert value into dynany,1.0
remove beancontextserviceslistener from beancontext,0.0
append value of a date time field to formatter,1.6
provide support for xml namespaces,0.0
insert element into queue,1.0
change ui inputmap for component,0.0
return copy of this formatter with override zone,0.0
return color component for pixel,0.0
register mbean in mbean server,0.0
return origin of the specified item in coordinate system,0.0
get signature of the primary method for interface,0.0
return position in serialblob object,0.0
compare serialstruct to object,0.0
write sql ref value to stream,0.0
obtain label for units,0.0
set location to values,0.0
set value to maximum,0.0
return number of bytes in blob value,0.0
return enumeration value table for class finishings,0.0
add border around viewport,0.0
return name for locale,1.0
read corba longlong value from input stream,1.0
return array by typically,0.0
return volatileimage with data layout,1.0
wrap float array into buffer,0.0
write icc_profile to outputstream,0.0
receive frame events from frame,0.0
replace characters in substring of this sequence,0.0
unblock multicast datagrams from source address,0.0
move cursor to row,1.0
return color for state,0.0
obtain midi sequence from url,0.0
report change to replacement value,0.0
convert point in user space,0.0
read corba value from input stream,0.0
return amount of memory in bytes,1.667
return currency instance for currency code,0.0
bind reference to name,0.0
create line border with color,0.0
write char value to stream,1.0
set system properties to properties argument,0.0
add menukeylistener to popup menu,0.0
return degree for role reference,1.0
refresh rules from data provider,0.0
indicate annotation type for annotation type,0.0
set comment string for entry,0.0
set selection mode for list,0.0
obtain timing resolution for midi,0.0
resolve systemid against baseuri,0.0
return boolean from defaults,0.0
perform action upon phase advance,0.0
replace entry for key,1.0
fetch location along flow axis,0.0
set parameter to reader object,1.0
compare transition to another,0.0
retrieve column title for column,0.0
set parameter to java value,0.0
read up to characters of data,0.0
return string representation of this check box group including value of current selection,0.0
return number of color components in input color space of this profile,0.0
obtain slave synchronization mode for sequencer,0.0
create graphics context for drawing buffer,0.0
insert element at tail of this deque,0.0
locate factories for print services,0.0
set transform to rotation transformation,0.0
display characters in text,0.0
return action for character errors,0.0
paste text from system clipboard,0.0
get value of this field from object,0.0
register object descriptor for object,0.0
retrieve role value for role name,1.0
return stream of code point values from sequence,0.0
include user in role,0.0
return data array element from bank,1.429
set data array element to float,1.0
get error event handler for transformerfactory,0.0
compare string to object,0.0
return ancestor to node,0.0
report executionexception with throwable,0.0
set selection end for text component,0.0
set state for track,1.0
ignore data definition statement within transaction,0.0
load class from codebase url path,1.0
set stream position to location,0.0
set text contents to string,0.0
retain elements in vector,0.0
return name with sequence of characters,0.0
bind uri to default namespace,0.0
read string value from input stream,1.0
insert string representation of a subarray of the str array argument into sequence,0.0
set descriptors in info array of type indescriptortype,0.0
insert element at position,1.0
return size in bytes,0.0
"perform parallelprefix(int [ ] , intbinaryoperator ) for subrange of the array",0.0
return copy of this period with days,0.0
return copy of this date time with field,0.0
set parameter to ref object,0.0
apply times to date,0.0
return size in bits of samples,0.0
compare object with principal,0.0
get xml element qname for jaxbelement,0.0
install tableheader as columnheaderview of the scroll pane,0.0
retrieve setting for fetch direction,0.0
obtain instance of chronolocaldatetime from object,0.0
return spliterator over elements,0.0
set logging message level for level,0.0
determine default printing attribute value in category,0.0
compare string to string,0.0
insert string representation of the boolean argument into sequence,0.0
remove mapping for key,1.0
return dimensions of the page in pixels,0.0
add address to end of the list of addresses,0.0
set parameter in command,0.0
obtain date time from system clock,1.0
invoke getcellbounds method on ui,0.0
insert item into choice,0.0
return hash code for value,0.0
add extension element to wsa,0.0
add custom entries to defaults,0.0
return component to right,0.0
add string object to contextlist object,0.0
provide mapping for region,0.0
add columns from index0,0.0
return rendering hints for operation,0.0
compare descriptor to object,0.0
return component in range,1.0
obtain instance of year from text string,1.0
set system identifier for source,0.0
return hashcode for constructor,0.0
return square of the distance from point,0.0
append string representation of the char array argument to sequence,0.0
return hit for caret,1.0
create endpoint object with binding,0.0
perform synchronization between object,0.0
obtain clip from mixer,0.0
prepare image for rendering,0.0
compute union of this rectangle with rectangle,0.0
compare crl entry for equality,0.0
return number in sequence,1.0
return hash code value for set attribute,0.0
associate thread with threadinfo,0.0
return reference for object,1.75
append elements in roleunresolvedlist,0.0
remove child from beancontext,0.0
return number of pages in book,0.0
associate type information with attribute,0.0
set url property for object,0.0
return int value with bit,0.0
write data to mixer,0.0
associate property with document,0.0
return element in set,1.0
extract time as nanos of day,0.0
retrieve localization resource bundle for logger,0.0
find method type with parameter type,0.0
add entries to registry,0.0
set source for subprocess standard,0.0
